{
  "schema_version": "1.0.0",
  "primary_source": "logical_json",
  "history": [
    {
      "version": "1.0.0",
      "change": "Initial logical map; no Figma or code implementation claimed."
    }
  ],
  "tokens": {
    "font": "system-ui",
    "spacing_unit_px": 4,
    "focus_visible": true,
    "semantic_roles": [
      "background",
      "surface",
      "text",
      "muted",
      "border",
      "accent",
      "danger",
      "warning",
      "success"
    ],
    "themes": [
      "light",
      "dark"
    ],
    "brand_status": "proposed_not_user_locked"
  },
  "components": [
    {
      "id": "atom.button",
      "name": "Button",
      "composes": [],
      "variants": [
        "default",
        "disabled",
        "error"
      ],
      "themes": [
        "light",
        "dark"
      ],
      "status": "logical_specification_only",
      "code_path": null,
      "figma_node_id": null
    },
    {
      "id": "atom.icon-button",
      "name": "IconButton",
      "composes": [
        "atom.button"
      ],
      "variants": [
        "default",
        "disabled",
        "error"
      ],
      "themes": [
        "light",
        "dark"
      ],
      "status": "logical_specification_only",
      "code_path": null,
      "figma_node_id": null
    },
    {
      "id": "atom.text-field",
      "name": "TextField",
      "composes": [],
      "variants": [
        "default",
        "disabled",
        "error"
      ],
      "themes": [
        "light",
        "dark"
      ],
      "status": "logical_specification_only",
      "code_path": null,
      "figma_node_id": null
    },
    {
      "id": "atom.decimal-field",
      "name": "DecimalField",
      "composes": [
        "atom.text-field"
      ],
      "variants": [
        "default",
        "disabled",
        "error"
      ],
      "themes": [
        "light",
        "dark"
      ],
      "status": "logical_specification_only",
      "code_path": null,
      "figma_node_id": null
    },
    {
      "id": "atom.unit-select",
      "name": "UnitSelect",
      "composes": [],
      "variants": [
        "default",
        "disabled",
        "error"
      ],
      "themes": [
        "light",
        "dark"
      ],
      "status": "logical_specification_only",
      "code_path": null,
      "figma_node_id": null
    },
    {
      "id": "atom.badge",
      "name": "Badge",
      "composes": [],
      "variants": [
        "default",
        "disabled",
        "error"
      ],
      "themes": [
        "light",
        "dark"
      ],
      "status": "logical_specification_only",
      "code_path": null,
      "figma_node_id": null
    },
    {
      "id": "atom.evidence-label",
      "name": "EvidenceTypeLabel",
      "composes": [
        "atom.badge"
      ],
      "variants": [
        "default",
        "disabled",
        "error"
      ],
      "themes": [
        "light",
        "dark"
      ],
      "status": "logical_specification_only",
      "code_path": null,
      "figma_node_id": null
    },
    {
      "id": "atom.status",
      "name": "StatusIndicator",
      "composes": [
        "atom.badge"
      ],
      "variants": [
        "default",
        "disabled",
        "error"
      ],
      "themes": [
        "light",
        "dark"
      ],
      "status": "logical_specification_only",
      "code_path": null,
      "figma_node_id": null
    },
    {
      "id": "atom.tooltip",
      "name": "Tooltip",
      "composes": [],
      "variants": [
        "default",
        "disabled",
        "error"
      ],
      "themes": [
        "light",
        "dark"
      ],
      "status": "logical_specification_only",
      "code_path": null,
      "figma_node_id": null
    },
    {
      "id": "atom.checkbox",
      "name": "Checkbox",
      "composes": [],
      "variants": [
        "default",
        "disabled",
        "error"
      ],
      "themes": [
        "light",
        "dark"
      ],
      "status": "logical_specification_only",
      "code_path": null,
      "figma_node_id": null
    },
    {
      "id": "atom.focus-ring",
      "name": "FocusRing",
      "composes": [],
      "variants": [
        "default",
        "disabled",
        "error"
      ],
      "themes": [
        "light",
        "dark"
      ],
      "status": "logical_specification_only",
      "code_path": null,
      "figma_node_id": null
    },
    {
      "id": "molecule.quantity-input",
      "name": "QuantityInput",
      "composes": [
        "atom.decimal-field",
        "atom.unit-select"
      ],
      "variants": [
        "default",
        "read_only",
        "partial"
      ],
      "themes": [
        "light",
        "dark"
      ],
      "status": "logical_specification_only",
      "code_path": null,
      "figma_node_id": null
    },
    {
      "id": "molecule.source-citation",
      "name": "SourceCitation",
      "composes": [
        "atom.button",
        "atom.evidence-label"
      ],
      "variants": [
        "default",
        "read_only",
        "partial"
      ],
      "themes": [
        "light",
        "dark"
      ],
      "status": "logical_specification_only",
      "code_path": null,
      "figma_node_id": null
    },
    {
      "id": "molecule.metric-target",
      "name": "MetricTargetEditor",
      "composes": [
        "molecule.quantity-input",
        "atom.text-field"
      ],
      "variants": [
        "default",
        "read_only",
        "partial"
      ],
      "themes": [
        "light",
        "dark"
      ],
      "status": "logical_specification_only",
      "code_path": null,
      "figma_node_id": null
    },
    {
      "id": "molecule.constraint-row",
      "name": "ConstraintRow",
      "composes": [
        "molecule.quantity-input",
        "atom.checkbox"
      ],
      "variants": [
        "default",
        "read_only",
        "partial"
      ],
      "themes": [
        "light",
        "dark"
      ],
      "status": "logical_specification_only",
      "code_path": null,
      "figma_node_id": null
    },
    {
      "id": "molecule.ingredient-line",
      "name": "IngredientLine",
      "composes": [
        "molecule.quantity-input",
        "atom.text-field"
      ],
      "variants": [
        "default",
        "read_only",
        "partial"
      ],
      "themes": [
        "light",
        "dark"
      ],
      "status": "logical_specification_only",
      "code_path": null,
      "figma_node_id": null
    },
    {
      "id": "molecule.identity-picker",
      "name": "IdentityPicker",
      "composes": [
        "atom.text-field",
        "atom.badge"
      ],
      "variants": [
        "default",
        "read_only",
        "partial"
      ],
      "themes": [
        "light",
        "dark"
      ],
      "status": "logical_specification_only",
      "code_path": null,
      "figma_node_id": null
    },
    {
      "id": "molecule.approval-summary",
      "name": "ApprovalSummary",
      "composes": [
        "atom.status",
        "atom.button"
      ],
      "variants": [
        "default",
        "read_only",
        "partial"
      ],
      "themes": [
        "light",
        "dark"
      ],
      "status": "logical_specification_only",
      "code_path": null,
      "figma_node_id": null
    },
    {
      "id": "molecule.resource-budget",
      "name": "ResourceBudget",
      "composes": [
        "molecule.quantity-input",
        "atom.status"
      ],
      "variants": [
        "default",
        "read_only",
        "partial"
      ],
      "themes": [
        "light",
        "dark"
      ],
      "status": "logical_specification_only",
      "code_path": null,
      "figma_node_id": null
    },
    {
      "id": "molecule.inline-finding",
      "name": "InlineFinding",
      "composes": [
        "atom.status",
        "atom.tooltip"
      ],
      "variants": [
        "default",
        "read_only",
        "partial"
      ],
      "themes": [
        "light",
        "dark"
      ],
      "status": "logical_specification_only",
      "code_path": null,
      "figma_node_id": null
    },
    {
      "id": "organism.contract-editor",
      "name": "ContractEditor",
      "composes": [
        "molecule.metric-target",
        "molecule.constraint-row",
        "molecule.approval-summary"
      ],
      "variants": [
        "default",
        "read_only",
        "partial"
      ],
      "themes": [
        "light",
        "dark"
      ],
      "status": "logical_specification_only",
      "code_path": null,
      "figma_node_id": null
    },
    {
      "id": "organism.formulation-editor",
      "name": "FormulationEditor",
      "composes": [
        "molecule.ingredient-line",
        "molecule.identity-picker",
        "molecule.inline-finding"
      ],
      "variants": [
        "default",
        "read_only",
        "partial"
      ],
      "themes": [
        "light",
        "dark"
      ],
      "status": "logical_specification_only",
      "code_path": null,
      "figma_node_id": null
    },
    {
      "id": "organism.evidence-panel",
      "name": "EvidencePanel",
      "composes": [
        "molecule.source-citation",
        "atom.evidence-label"
      ],
      "variants": [
        "default",
        "read_only",
        "partial"
      ],
      "themes": [
        "light",
        "dark"
      ],
      "status": "logical_specification_only",
      "code_path": null,
      "figma_node_id": null
    },
    {
      "id": "organism.candidate-diff",
      "name": "CandidateDiff",
      "composes": [
        "organism.formulation-editor",
        "atom.button"
      ],
      "variants": [
        "default",
        "read_only",
        "partial"
      ],
      "themes": [
        "light",
        "dark"
      ],
      "status": "logical_specification_only",
      "code_path": null,
      "figma_node_id": null
    },
    {
      "id": "organism.metric-comparison",
      "name": "MetricComparisonTable",
      "composes": [